{
  "aegisVersion": "1.0-draft",
  "packetType": "aegis.intent.present.v1",
  "packetId": "aegis:packet:01JZK90E22",
  "issuer": "did:aegis:agent:sre.remediator",
  "audience": "aegis://k8s/prod-checkout/admission",
  "issuedAt": "2026-05-18T08:41:00Z",
  "expiresAt": "2026-05-18T09:15:00Z",
  "nonce": "b64u-7Kp0Y2nDLf41",
  "registry": "aegis.registry://enterprise.example/root",
  "bodyDigest": "sha256:81284a9d9ec0b44e52ad82bdf20a191c7a91c0ffee1111cfe31baa10bb08",
  "body": {
    "intent": {
      "intentId": "aegis:intent:ticket-8128",
      "issuer": "did:web:enterprise.example",
      "subject": "did:aegis:agent:sre.remediator",
      "goal": "restore degraded checkout service",
      "scopes": ["k8s.rollout.read", "k8s.rollout.restart"],
      "constraints": [{ "type": "maxRisk", "value": 0.42 }],
      "autonomy": "supervised",
      "expiresAt": "2026-05-18T09:15:00Z",
      "signature": {
        "alg": "EdDSA",
        "kid": "did:web:enterprise.example#ops-approval",
        "value": "b64u-example-intent-signature"
      }
    }
  },
  "signature": {
    "alg": "EdDSA",
    "kid": "did:aegis:agent:sre.remediator#signing-2026-q2",
    "value": "b64u-example-packet-signature"
  }
}
