{
  "aegisVersion": "1.0-draft",
  "packetType": "aegis.registry.reconcile.v1",
  "packetId": "aegis:packet:01JZK9A0D2",
  "issuer": "aegis.registry://enterprise.example/root",
  "audience": "aegis.registry://cloud.provider/root",
  "issuedAt": "2026-05-18T08:50:00Z",
  "nonce": "b64u-q7NcBf2XkL55",
  "registry": "aegis.registry://enterprise.example/root",
  "bodyDigest": "sha256:65a31b4a9d9ec0b44e52ad82bdf20a191c7a91c0ffee1111cfe31baa10bb",
  "body": {
    "sourceRoot": "aegis.registry://enterprise.example/root",
    "targetRoot": "aegis.registry://cloud.provider/root",
    "treeSize": 220184,
    "rootDigest": "sha256:65a31b4a9d9ec0b44e52ad82bdf20a191c7a91c0ffee1111cfe31baa10bb",
    "consistencyProof": ["sha256:4a9d9ec0b44e52ad82bdf20a191c7a91c0ffee1111cfe31baa10bb08"]
  },
  "signature": {
    "alg": "EdDSA",
    "kid": "aegis.registry://enterprise.example/root#reconcile-2026-q2",
    "value": "b64u-example-registry-signature"
  }
}
