{
  "aegisVersion": "1.0-draft",
  "packetType": "aegis.identity.hello.v1",
  "packetId": "aegis:packet:01JZK8ZP91",
  "issuer": "did:aegis:agent:sre.remediator",
  "audience": "aegis://enterprise.example/verifiers/edge",
  "issuedAt": "2026-05-18T08:40:00Z",
  "expiresAt": "2026-05-18T08:45:00Z",
  "nonce": "b64u-4J0sS7dZfQn3",
  "registry": "aegis.registry://enterprise.example/root",
  "bodyDigest": "sha256:4a9d9ec0b44e52ad82bdf20a191c7a91c0ffee1111cfe31baa10bb0865a31b",
  "body": {
    "supportedVersions": ["1.0-draft"],
    "namespaces": ["aegis://enterprise.example/sre"],
    "identity": {
      "did": "did:aegis:agent:sre.remediator",
      "namespace": "aegis://enterprise.example/sre",
      "controller": "did:web:enterprise.example",
      "keyRefs": ["did:aegis:agent:sre.remediator#signing-2026-q2"],
      "attestationRefs": ["aegis:trust:fips-runtime-29"]
    }
  },
  "signature": {
    "alg": "EdDSA",
    "kid": "did:aegis:agent:sre.remediator#signing-2026-q2",
    "value": "b64u-example-signature"
  }
}
